Text1,Text2,Text3,Text4
Eating pizza every day,Having sushi every day,Enjoying a gourmet meal,Going on a juice cleanse
Traveling to the past,Traveling to the future,Exploring parallel universes,Staying in the present moment
Bungee jumping,Skydiving,Paragliding,Rock climbing
Owning a sports car,Having a luxury yacht,Driving a classic convertible,Sailing on a private cruise
Living in a bustling city,Living in a peaceful countryside,Residing in a beachfront villa,Settling in a mountain cabin
Becoming a famous actor,Becoming a successful entrepreneur,Becoming a world-class athlete,Becoming a renowned scientist
Learning to play a musical instrument,Learning a new language,Mastering a dance style,Developing a new hobby
Reading a book,Watching a movie,Listenting to a podcast,Playing a video game
Climbing a mountain,Scuba diving in the ocean,Skiing down a slope,Surfing on a wave
Being a superhero,Being a wizard,Being a spy,Being a ninja
Owning a pet dog,Owning a pet cat,Owning a pet rabbit,Owning a pet bird
Going to the moon,Going to Mars,Exploring Venus,Visiting an asteroid
Living without internet,Living without television,Living without social media,Living without electricity
Working from home,Working in an office,Freelancing,Starting a home-based business
Having a personal chef,Having a personal trainer,Hiring a personal stylist,Hiring a personal assistant
Visiting the Eiffel Tower,Visiting the Statue of Liberty,Seeing the Great Wall of China,Exploring the pyramids of Egypt
Writing a novel,Painting a masterpiece,Composing a symphony,Creating a sculpture
Having the ability to fly,Having the ability to teleport,Having the ability to time travel,Having the ability to shape-shift
Spending a day at the beach,Spending a day in the mountains,Spending a day in a bustling city,Spending a day in a desert
Owning a time machine,Having a teleportation device,Having a mind-reading device,Having a reality-altering device
Going on a world tour,Staying in one place for life,Living as a digital nomad,Embarking on a backpacking journey
Swimming with dolphins,Swimming with sharks,Snorkeling with turtles,Scuba diving with manta rays
Winning an Olympic gold medal,Winning a Nobel Prize,Winning a Pulitzer Prize,Winning a Grammy Award
Having a photographic memory,Having perfect pitch,Having exceptional taste buds,Having extraordinary strength
Living in a treehouse,Living in an underwater city,Living in a futuristic space station,Living in a medieval castle
Being a master of martial arts,Being a chess grandmaster,Being a skilled archer,Being a master fencer
Attending Hogwarts,Attending Starfleet Academy,Attending Xavier's School for Gifted Youngsters,Attending Jedi Academy
Solving world hunger,Solving climate change,Solving renewable energy challenges,Solving space exploration challenges
Running a marathon,Climbing Mount Everest,Completing a triathlon,Participating in an Ironman competition
Having the power of telekinesis,Having the power of telepathy,Having the power of pyrokinesis,Having the power of shape-shifting
Visiting the Great Barrier Reef,Visiting the Amazon Rainforest,Exploring the Serengeti,Climbing the Himalayas
Going on a spacewalk,Going on a deep-sea dive,Exploring a cave,Parasailing over the ocean
Becoming a famous singer,Becoming a renowned scientist,Becoming a celebrated chef,Becoming a successful author
Living in a futuristic city,Living in a medieval castle,Living in a quaint village,Living in a modern suburban neighborhood
Having a personal robot assistant,Having a talking animal companion,Having a flying drone assistant,Having a holographic assistant
Experiencing zero gravity,Experiencing total silence,Experiencing virtual reality,Experiencing augmented reality
Being able to speak all languages,Being able to communicate with animals,Being able to understand plants,Being able to decipher ancient languages
Owning a private island,Owning a private jet,Owning a private art collection,Owning a private zoo
Discovering a new species,Discovering a new planet,Discovering a new element,Discovering a new galaxy
Having a personal library,Having a home theater,Having a private art studio,Having a game room with all the latest technology
Learning to dance salsa,Learning to play chess,Learning to cook gourmet meals,Learning to code software
Having the ability to heal others,Having the ability to read minds,Having the ability to control the weather,Having the ability to manipulate time
Participating in a reality show,Participating in a game show,Participating in a talent show,Participating in a cooking competition
Camping in the mountains,Camping on a tropical island,Camping in the desert,Camping in a dense forest
Becoming a famous chef,Becoming a successful architect,Becoming a world-class athlete,Becoming a renowned fashion designer
Living in a world without music,Living in a world without books,Living in a world without technology,Living in a world without nature
Riding a roller coaster,Paragliding,Bungee jumping,Skydiving
Being a famous fashion designer,Being a famous filmmaker,Being a famous musician,Being a famous visual artist
Driving a convertible,Driving a 4x4 off-road vehicle,Driving a luxury sports car,Driving an electric car
Taking a hot air balloon ride,Taking a helicopter tour,Taking a cruise on a luxury liner,Taking a ride in a vintage train
Attending the Olympics,Attending the World Cup,Attending the Super Bowl,Attending the Academy Awards
Having a personal spaceship,Having a personal submarine,Having a personal jetpack,Having a personal hoverboard
Skiing in the Alps,Surfing in Hawaii,Rock climbing in Yosemite,Mountain biking in the Andes
Building a snowman,Building a sandcastle,Building a treehouse,Building a life-size sculpture
Running a successful YouTube channel,Running a successful podcast,Running a successful blog,Running a successful online business
Having the power of invisibility,Having the power of super strength,Having the power of telekinesis,Having the power of time manipulation
Learning to code,Learning to play a sport,Learning to play a musical instrument,Learning to dance
Being a master of disguise,Being a master of mimicry,Being a master of illusions,Being a master of acrobatics
Sailing around the world,Backpacking through Europe,Driving across the Americas,Flying around the globe
Having a personal assistant,Having a personal masseuse,Having a personal stylist,Having a personal chauffeur
Living in a world without smartphones,Living in a world without computers,Living in a world without cars,Living in a world without electricity
Winning the lottery,Discovering hidden treasure,Inheriting a fortune,Creating a successful startup
